<?xml version="1.0" encoding="UTF-8"?>
<!--
  ~ Copyright 2012 LIG SIGMA
  ~
  ~ Licensed under the Apache License, Version 2.0 (the "License");
  ~ you may not use this file except in compliance with the License.
  ~ You may obtain a copy of the License at
  ~
  ~     http://www.apache.org/licenses/LICENSE-2.0
  ~
  ~ Unless required by applicable law or agreed to in writing, software
  ~ distributed under the License is distributed on an "AS IS" BASIS,
  ~ WITHOUT WARRANTIES OR CONDITIONS OF ANY KIND, either express or implied.
  ~ See the License for the specific language governing permissions and
  ~ limitations under the License.
  -->

<astral xmlns:xsi="http://www.w3.org/2001/XMLSchema-instance" xsi:noNamespaceSchemaLocation="astral.xsd">
    <query t0="auto">
        <sigma impl="SigmaStream" type="Stream">
            <condition attribute="id" operator="=" value="1"/>
            <streamer impl="Rsu" stype="Rsu" type="Stream">
                <join impl="RelationalJoin" type="Relation">
                    <window impl="Window" type="Relation">
                        <description wtype="L"/>
                        <source id="S" type="Stream"/>
                    </window>
                    <source id="R" type="Relation"/>
                </join>
            </streamer>
        </sigma>
    </query>
    <sources>
        <source attributes="id, T, PHYID" id="S" type="Stream"/>
        <source attributes="v, PHYID" id="R" type="Relation"/>
    </sources>
</astral>